name,price,description,stock,image,keyword,precaution,ingredients,uses,category
Hashmi Migrokill Capsule | Ayurvedic Capsules For Headache & Migraine 100% Pure,1487,Migrokill Capsule Migraine Treatment Medicine at home is for all those people out there who are unable to control this severe issue with general measures. Migraine is one of the worst problems that could arise to a human due to its direct connection to brain,129,https://firebasestorage.googleapis.com/v0/b/app-project-ayurveda2.appspot.com/o/1653289390465_2Hashmi.jpg?alt=media&token=image,"Hashmi Migrokill Capsule | Ayurvedic Capsules For Headache & Migraine 100% Pure, haedache, sar dukhne ki dawa, sar dard ki dawa, head me pain","Curb the caffeine, Be careful with exercise, Get regular shut-eye","Centella Asiatica-, Withania somnifera-, Acorus calamus-, Santalumalbum,Glycyrrhiza glabra",1 Capsule per day after meal,628b7d5d2f61643132a89b1f
Ayurvedic Life Migra Plus Migraine Support Tablet,179,Only the highest quality ingredients are used to give you the maximum benefit and protection for Migraine & headache relief,112,https://firebasestorage.googleapis.com/v0/b/app-project-ayurveda2.appspot.com/o/1653289947129_3Ayurvedic .jpg?alt=media&token=image,"Ayurvedic Life Migra Plus Migraine Support Tablet, haedache, sar dukhne ki dawa, sar dard ki dawa, head me pain","Curb the caffeine, Be careful with exercise, Get regular shut-eye,As with any dietary supplement, do not take without first consulting your healthcare practitioner"," Godanti Bhasma, Dashhamool, Brahmi, Shankhpushpi",1 tablets per day after meal,628b7d5d2f61643132a89b1f
Kottakkal Arya Vaidya Sala Migrakot Tablet 100's,420,Migrakot Tablet is a proprietary Ayurvedic medicine manufactured by Arya Vaidya Sala Kottakkal It's analgesic and anti oxidant properties help relieve headaches,60,https://firebasestorage.googleapis.com/v0/b/app-project-ayurveda2.appspot.com/o/1653290030234_4Kottakkal.jpg?alt=media&token=image,"Kottakkal Arya Vaidya Sala Migrakot Tablet 100's, haedache, sar dukhne ki dawa, sar dard ki dawa, head me pain",,"Pathya, Aksha, Dhatri, Bhunimba, Nisa, Nimba, Amrita",As indicated on bottle or directed by the physician,628b7d5d2f61643132a89b1f
Dr. Ortho Ayurvedic Capsules - 30 Caps,169,"Dr. Ortho Ayurvedic Capsules are helpful in relieving the painful condition of joints and muscles like stiffness, inflammation, and pain with the healing and anti-inflammatory properties of efficient herbs",49,https://firebasestorage.googleapis.com/v0/b/app-project-ayurveda2.appspot.com/o/1653290074117_5Dr. Ortho .webp?alt=media&token=image,"Dr. Ortho Ayurvedic Capsules - 30 Caps,  stiffness, inflammation, hand pain, joint pain, hath me dard, hath ka dukhna","not for children, do not take without first consulting your healthcare practitioner","Kunduru, Guggul Shuddh, Rasna, Methi, Sunth, Ashwagandha, Vishamushti, & Shilajit Shudh",Take 2 capsules twice a day with lukewarm water or with milk. Or as directed by the physician,628b7d5d2f61643132a89b1f
Joint Health with Boswellia White Willow Bark & Guggul – 60 Vegan Capsules,1299,Foresta Organics’ Joint Health helps prevent knee-pain & joint swelling. A regular dosage of Boswellia extract helps reduce cartilage degradation and discomfort in the case of arthritis,82,https://firebasestorage.googleapis.com/v0/b/app-project-ayurveda2.appspot.com/o/1653290321810_6Joint .webp?alt=media&token=image,"Joint Health with Boswellia White Willow Bark & Guggul – 60 Vegan Capsules, joint swelling, knee-pain,  hath me dard, hath ka dukhna","As with any supplement, consult a healthcare practitioner before use if you are pregnant, nursing, taking medication","Plant based cellulose (capsule), microcrystalline cellulose, pregelatinised starch, No ingredients of animal origin",Adults take 2 capsules twice daily with food,628b7d5d2f61643132a89b1f
Ortho Veda Pain Relief & Joints Massage Herbal Oil,2900,"Ortho Veda oil is popular ayurvedic Vata massage oil, particularly beneficial for pain pertaining to bones and muscles",52,https://firebasestorage.googleapis.com/v0/b/app-project-ayurveda2.appspot.com/o/1653290406837_7Ortho.jpg?alt=media&token=image,"Ortho Veda Pain Relief & Joints Massage Herbal Oil,  joint swelling, knee-pain,  hath me dard, hath ka dukhna","The results of Ortho Veda Pain Relief oil may vary from person to person, depending on their age, lifestyle and condition","Cow milk, Black sesame oil, Wild asparagus, Giant potato, Brahmin ginseng, Vigna, Saffron crocus, Camphor, Indian ironwood, Bitumen, RocksaIt, Cardamom, Licorice, and Nutgrass","Use twice daily in case of severe pain. Repeat as necessary, As directed by the physician",628b7d5d2f61643132a89b1f
Painquit tablet and Roll on Combo,540,This combo is a complementary therapy for bone and joint health and includes 100% herbal and clinically proven Painquit tablets along with Painquit Roll-On for local relief,58,https://firebasestorage.googleapis.com/v0/b/app-project-ayurveda2.appspot.com/o/1653290466630_8Painquit.jpg?alt=media&token=image,"Painquit tablet and Roll on Combo,  joint swelling, per me dard, per ka dard, per m sujan, pain, inflammation, mobility, flexibility and strength","Read the label carefully before use, Store in a cool and dry place away from direct sunlight, Keep out of reach of the children, use under medical supervision","Boswellia (Guggul), Turmeric and Rasna","Take 2 tablets twice a day after meals, It is recommended to take daily for 3 months",628b7d5d2f61643132a89b1f
BIO JOINTARTHO TABLET,86,Biojoint 50mg Tablet is used in the treatment of osteoarthritis. It lowers pain and swelling and helps the stiff joints to heal quickly. It may be used alone or in combination with other medicines,44,https://firebasestorage.googleapis.com/v0/b/app-project-ayurveda2.appspot.com/o/1653290601403_9.jpg?alt=media&token=image,"BIO JOINTARTHO TABLET,   joint swelling, per me dard, per ka dard, per m sujan, pain","Swallow it as a whole. Do not chew, crush or break it","Nisoth 1.5mg, Bhallatak 2.5mg, Kanak Beej","Take this medicine in the dose and duration as advised by your doctor, Biojoint 50mg Tablet is to be taken with food",628b7d5d2f61643132a89b1f
Devtvakadi Ayurvedic Pain Relief oil with Cinnamon and Clove,700,Leg Pain Relief Oil is a blend of age old Indian Ayurveda and contemporary scientific research on natural herbs,54,https://firebasestorage.googleapis.com/v0/b/app-project-ayurveda2.appspot.com/o/1653290655294_10Devt.jpg?alt=media&token=image,"Devtvakadi Ayurvedic Pain Relief oil with Cinnamon and Clove, per me dard, per ka dard, per m sujan, pain","Don’t eat fried, don’t have junk food","Cymene, Dipentene, Limonene, Phellandrene, and Pinene","Use twice daily in case of severe pain. Repeat as necessary, As directed by the physician",628b7d5d2f61643132a89b1f
Hashmi Jaundinil Capsule |useful For Jaundice Medicine 100% Herbal,997,Hashmi Pharmacy offers the optimum Jaundice Treatment Medicine that is specifically designed to target the cause and remove the symptoms from the first dosage. The medicine is extensively tested to ensure that it works powerfully and directly to heal the liver and its related processes,78,https://firebasestorage.googleapis.com/v0/b/app-project-ayurveda2.appspot.com/o/1653290708942_11Hashmi.webp?alt=media&token=image,"Hashmi Jaundinil Capsule |useful For Jaundice Medicine 100% Herbal, jaundice medicine, jaundice ki dawa, jaundice ka ilaaj","Store in a cool and dry place away from direct sunlight, Keep out of reach of the children","Solanum nigrum-, Rubia cordifolia-., Valerina officinalis-., Piper cubeba-, Chena podium alibum-, caccinia glauca-, Peari-, Nigella sativa",Take this medicine in the dose and duration as advised by your docto,628b7d5d2f61643132a89b1f
AyuLite  Liver Tonic  Hepatitis and Jaundice,1190,"Ayulite is a herbal combination that heals, protects, tones and strengthens the liver functioning for better absorption and purification of blood",81,https://firebasestorage.googleapis.com/v0/b/app-project-ayurveda2.appspot.com/o/1653295028903_12AyuL.webp?alt=media&token=image,"AyuLite  Liver Tonic  Hepatitis and Jaundice, jaundice medicine, jaundice ki dawa, jaundice ka ilaaj",Store in a cool dry place below 250C Ayurvedic Proprietary Medicine,"Andrographis paniculata extract, Tecoma undulata, Tephrosia purpurea extract, Phyllanthus niruri extract, Eclipta alba extract, Holarrhena antidysenterica, Glycyrrhiza glabra, Fumaria parviflora extract, Tinospora cordifolia, Hedychium spicatum, Boerhaavia diffusa",2 Capsules 2 times daily,628b7d5d2f61643132a89b1f
"Patanjali Ayurveda Giloy Ghan Vati 60 Tablets, common cold high cholesterol hepatitis jaundice liver disorders skin and urinary disorders",95,Assists in improving memory and boost intelligence.Enhance cognitive functions.The rejuvenating feature of giloy is known to improve life expectancy,130,https://firebasestorage.googleapis.com/v0/b/app-project-ayurveda2.appspot.com/o/1653295057104_13Patanjali .jpg?alt=media&token=image,"Patanjali Ayurveda Giloy Ghan Vati 60 Tablets, common cold high cholesterol hepatitis jaundice liver disorders skin and urinary disorders, jaundice medicine, jaundice ki dawa, jaundice ka ilaaj","Read the label carefully before use, Do not exceed the recommended dose, Keep out of the reach and sight of children","giloy,  Saffron crocus, Camphor, Indian ironwood, Bitumen, RocksaIt, Cardamom, Licorice","Above 12 years: 1 tablet twice daily, Below 12 years: Half tablet twice daily or as directed by the physician",628b7d5d2f61643132a89b1f
Patanjali Ayurveda Youvan Churna- 100Gm,250,"Patanjali Divya Youvan Churna is an ayurvedic medicine that is primarily used for the treatment of Weakness, Erectile Dysfunction",178,https://firebasestorage.googleapis.com/v0/b/app-project-ayurveda2.appspot.com/o/1653295097865_14.png?alt=media&token=image,"Patanjali Ayurveda Youvan Churna- 100Gm, malaria ki dawa, malaria ka ilaaj","Read the label carefully before use, Do not exceed the recommended dose","Ashwagandha, Eucalyptus, Vang bhasma, Jahar mohra bhasma , Behman safed, Butea monosperma",after meal 2.1 gm,628b7d5d2f61643132a89b1f
Himalaya Flora sante Capsule 20,550,Florasante is a gut supplement consisting of room-temperature stable probiotics and a botanical extract. Florasante helps in symptomatic relief from Irritable Bowel Syndrome (IBS) and supports gut health,54,https://firebasestorage.googleapis.com/v0/b/app-project-ayurveda2.appspot.com/o/1653295169787_15.webp?alt=media&token=image,"Himalaya Flora sante Capsule 20, malaria ki dawa, malaria ka ilaaj","Do not exceed the recommended dose,  take with milk","Probiotics, Barley beta glucan, Bael [Aegle marmelos]","1-2 capsules twice daily, or as directed by your health care professional",628b7d5d2f61643132a89b1f
Himalaya Immusante Tablet-20,72,"Himalaya Immusante Tablet has broad-spectrum antimicrobial, anti-inflammatory, and antioxidant properties. It is recommended for immunotherapeutic support in situations where immunity is compromised",73,https://firebasestorage.googleapis.com/v0/b/app-project-ayurveda2.appspot.com/o/1653295198538_16.webp?alt=media&token=image,"Himalaya Flora sante Capsule 20, malaria ki dawa, malaria ka ilaaj","Store in a cool, dry place away from direct sunlight, Read the label carefully before use, Do not exceed the recommended dose, Keep out of the reach of children","Shanta (Prosopis glandulosa), Lodhra (Symplocos racemosa)",as directed by your physician,628b7d5d2f61643132a89b1f
AYUSH-64 40 Tablets,319,Ayush-64 Tablet provides help in the malarial fevers which have been identified as a distinct clinical condition in Ayurveda from ancient times. CCRS has developed a herbal anti-malarial preparation.,39,https://firebasestorage.googleapis.com/v0/b/app-project-ayurveda2.appspot.com/o/1653295329343_17.jpg?alt=media&token=image,"AYUSH-64 40 Tablets, dengue ka ilaaj, dengue ki dawa","Read the label carefully before use, Store in a cool dry place away from direct sunlight, Keep out of reach of the children","Saptaparna stem, Katuki Root, Chirayata Whole Plant, Kuberaksha",Use as directed by the physician,628b7d5d2f61643132a89b1f
Nature Sure Agnimantha Weight Loss Formula For Men and Women (60 Capsules,1231,"Made with pure and top-grade natural ingredients, Nature Sure Agnimantha Weight Loss Formula helps reduce weight by improving digestion and increasing frequency of urination",98,https://firebasestorage.googleapis.com/v0/b/app-project-ayurveda2.appspot.com/o/1653295419329_18.jpg?alt=media&token=image,"Nature Sure Agnimantha Weight Loss Formula For Men and Women (60 Capsules, dengue ka ilaaj, dengue ki dawa","Nature Sure Agnimantha Weight-loss Formula is generally safe for oral consumption by adults in recommended doses, Nature Sure Agnimantha Weight-loss Formula is not recommended for pregnant and lactating women, children and infants","Tecoma undulata, Tephrosia purpurea extract, Phyllanthus niruri extract, Eclipta alba extract, Holarrhena antidysenterica, Glycyrrhiza glabra, Fumaria parviflora extract","If you are on other medication, consult your doctor before taking Agnimantha Weight Loss capsules",628b7d5d2f61643132a89b1f
Platenza tablets - 20tablets,75,Platenza boosts platelet count and reverses the thrombocytopenia (low platelet count) associated with dengue,54,https://firebasestorage.googleapis.com/v0/b/app-project-ayurveda2.appspot.com/o/1653295494927_19.webp?alt=media&token=image,"Platenza tablets - 20tablets, dengue ki dawa, dengue ka ilaaj","Read the label carefully before use, Store in a cool dry place away from direct sunlight, Keep it out of the reach of children","Maricha, Guduchi, Papaya, Bhudhatri",Please consult your physician to prescribe the dosage that best suits the condition,628b7d5d2f61643132a89b1f
Arjuna 60 Tablets,81,"Arjuna is a Ayurvedic herb, well known as a heart tonic, It strengthens heart tissue, improving its performance optimally. Arjuna purifies blood, keeps lipid metabolism under control and helps maintain healthy heart function",78,https://firebasestorage.googleapis.com/v0/b/app-project-ayurveda2.appspot.com/o/1653295525754_20.jpg?alt=media&token=image,"Arjuna 60 Tablets, hernia, hernia ka ilaaj, hernia ki dawa","consult a healthcare practitioner before use if you are pregnant, nursing, taking medication",Each Arjuna Tablet contains 500 mg of pure Arjuna,"1 to 2 Tablets 2 to 3 times a day with milk or lukewarm water, Please consult your physician to prescribe the dosage that best suits the condition",628b7d5d2f61643132a89b1f
Ayurvedic Hernia Treatment Pack For 30 Days,2723,Hernia Treatment Package is a complete herbal solution for Hernia Problem,39,https://firebasestorage.googleapis.com/v0/b/app-project-ayurveda2.appspot.com/o/1653295570654_21.jpg?alt=media&token=image,"Ayurvedic Hernia Treatment Pack For 30 Days, hernia ka ilaaj, hernia ki dawa","Decrease or avoid the amount of highly spicy, salty, oily, sweet foodDecrease the intake of excess tea, coffee, cold drinks, soft drinks, and other carbonated beverages, Avoid the addiction, if any.
OUR Product USP","Gokhru, Kaunch, Shatavari, Ashwagandha, Sunthi, dry ginger, Devdaru, Amalki Nisoth",Daily 2 tablets. One in the morning and one in the evening with warm water,628b7d5d2f61643132a89b1f
Zandu Khadiradi Gutika (70Tablets),88.2,"Unique herbal astringent, antiseptic, and expectorant medicin for curing throat disorders. Useful in dental, oral, throat and tonsillar infections",149,https://firebasestorage.googleapis.com/v0/b/app-project-ayurveda2.appspot.com/o/1653295614428_22.jpg?alt=media&token=image,"Ayurvedic Hernia Treatment Pack For 30 Days, hernia ka ilaaj, hernia ki dawa","consult a healthcare practitioner before use if you are pregnant, nursing, taking medication","Khadira Sar, Pushkara, Kakarshringi, Katphala, Bharangi, Haritaki, Lavanga, Shunthi, Maricha, Pippali, Ativisha, Krishna Jiraka, Yavaksara, Guduchi, Brihati, Kantakari, Bibhitaka.",1 to 4 tablets to be taken in the morning and evening. Not more than 12 tablets in a day,628b7d5d2f61643132a89b1f
Indo German Tonsi Care Tablets 25g,114,Tonsils play a significant role in maintaining the body's immune system. They are ideally situated to scrutinize ingested material and to react to those which pose a threat to the body,51,https://firebasestorage.googleapis.com/v0/b/app-project-ayurveda2.appspot.com/o/1653295685056_23.jpg?alt=media&token=image,"Indo German Tonsi Care Tablets 25g, tonsil, gale dukhna, gale me dard, gala","Store in a cool dry place away from direct sunlight, Keep it out of the reach of children,  Formula is not recommended for pregnant and lactating women, children and infants","mulethi, haldi, ginger, fenugreek",3 tablets of Indo German Tonsi Care Tablets 3 times a day,628b7d5d2f61643132a89b1f
Patanjali Singhnad Guggul Tablet 40's,28,"Beneficial in chronic rheumatism (arthritis Rimutaid), paralysis stroke, arthritis, tonsils",49,https://firebasestorage.googleapis.com/v0/b/app-project-ayurveda2.appspot.com/o/1653295746134_24.jpg?alt=media&token=image,"Patanjali Singhnad Guggul Tablet 40's, tonsil, gale dukhna, gale me dard, gala","Best Before-60 Months from Manufacturing Date, Store in a cool dry place away from direct sunlight","Arjun (Terminalia arjuna), Makoy (Solanum nigrum), Punarnava (Boerhaaviadiffusa), Nirgundi (Vitex negundo), Rasna (Pluchealanceolata), Giloy (Tinosporacordifolia), Chitrak (Plumbagozeylanica),Nagarmotha(Cyperusrotundus), Vaividang (Embeliaribes), Harad Chhoti (Terminaliachebula),Ashwagandha,(Withaniasomnifera), PipplaMool(Piperlongum), Dalchini,Cinnamomumzeylanicum), Sangeysav Pishti, Akik Pishti, PravalPishti,Muktashukti Bhasma, Jaharmohra Pishti and Mukta Pishti",As directed by the physician,628b7d5d2f61643132a89b1f
Tonsil Aid Tablets,200,Tonsil aid tablets Sore throat is a inconvenience or suffering in the throat area which makes swallowing very difficult,83,https://firebasestorage.googleapis.com/v0/b/app-project-ayurveda2.appspot.com/o/1653295773970_25.webp?alt=media&token=image,"Tonsil Aid Tablets, tonsil, gale dukhna, gale me dard, gala","Keep it out of the reach of children, consult a healthcare practitioner before use if you are pregnant, nursing, taking medication","mulethi, haldi, ginger, fenugreek",As prescribed by the doctor,628b7d5d2f61643132a89b1f
Kapiva Lungs Care Juice,495,"Kapiva Lungs Care Juice is loaded with natural Ayurvedic herbs like Noni, Ginger and Fennel Seeds. This juice helps improve lung health while also trying to combat tobacco-induced lung damage",194,https://firebasestorage.googleapis.com/v0/b/app-project-ayurveda2.appspot.com/o/1653295805353_26.webp?alt=media&token=image,"Kapiva Lungs Care Juice, lungs pain,  fefdo me dard ki dawa, seene me dard ki daa, lungs problems, lung me dard ki dawa","Store in a cool dry place away from direct sunlight, Shake the bottle before use",Ginger and Fennel seeds,"Dilute 30 ml of Lungs Care Juice in a glass of water, Consume twice daily after meals",628b7d5d2f61643132a89b1f
TrueBasics Lung Detox 30 tablet(s),565,TrueBasics Lung Detox may help improve immunity by increasing the multiplication of immune cells like B and T cells,73,https://firebasestorage.googleapis.com/v0/b/app-project-ayurveda2.appspot.com/o/1653295841720_27.jpg?alt=media&token=image,"TrueBasics Lung Detox 30 tablet(s),   fefdo me dard ki dawa, seene me dard ki daa, lungs problems, lung me dard ki dawa","Shake the bottle before use, Store in a cool dry place away from direct sunlight","Licorice, Quercetin, Vitamin C, Magnesium, Grapeseed Extract, Echinacea, Pine Bar",1 tablet daily after breakfast,628b7d5d2f61643132a89b1f
Lung Detox - 60 Veg Capsules,467,Pure Nutrition Lung Detox supplement is ideal for those looking to improve their lung functions and enhance respiratory health,49,https://firebasestorage.googleapis.com/v0/b/app-project-ayurveda2.appspot.com/o/1653295880325_28.jpg?alt=media&token=image,"Lung Detox - 60 Veg Capsules, fefdo me dard ki dawa, seene me dard ki daa, lungs problems, lung me dard ki dawa",it is possibly safe when used short-term when pregnant or breast-feeding. Consult with your healthcare provider before using it,"Vasaka Leaves Extract, Elaichi Fruit Extract: Elaichi, Echinacea Extract, Lotus Rhizome Extract, Inula Racemosa Root, Licorice, Ginger, Grape Seed, Stinging Nettle Leaf , Quercetin, Piper nigrum fruit ","Take 1 capsule twice daily after meals or as directed by your
healthcare professional",628b7d5d2f61643132a89b1f
Sunetra Regular,75,Sunetra carries the same function and goodness of tears. Regular use of Sunetra along with eye exercises can provide longevity to the eyes,28,https://firebasestorage.googleapis.com/v0/b/app-project-ayurveda2.appspot.com/o/1653295906283_29.webp?alt=media&token=image,"Sunetra Regular, eye pain, ankh me dard, ankh ka dukhkna",The nozzle of the bottle should not be touched by hand or with any other material,"jati, padmakar, tulsi,madhu, bhimseni, satapatri jala","For regular use, administer two drops in each eye twice a day. In case of difficulties or minor bacterial infections, use 4 times a day",628b7d5d2f61643132a89b1f
Jiwadaya Entyce - Rose Water Based Cooling Eye Drops - Ayurvedic & Herbal,320,"Ayurvedic, rose water-base makes it cool eye drops. A blend of nature's most effective herbs",58,https://firebasestorage.googleapis.com/v0/b/app-project-ayurveda2.appspot.com/o/1653295933504_30.jpg?alt=media&token=image,"Jiwadaya Entyce - Rose Water Based Cooling Eye Drops - Ayurvedic & Herbal, eye pain, ankh me dard, ankh ka dukhkna",The nozzle of the bottle should not be touched by hand or with any other material,"Neem, Tulsi, Bringaraj, Punarnava, Harikati, Amla, Beheda, Daru Haridra, Yesthimadhu, Peppermint Phool, Kapur, Gulab Jal, and Glycerin","1 to 2 drops, 2 to 3 times a day or as per requirement",628b7d5d2f61643132a89b1f
Eye Mantra Eye Drops,64,Divisa Herbal Eye Mantra Eye Drop works as an effective Ayurvedic eye drop for itchy eyes and red eyes. The eye infection drops helps to soothe stressed eyes and relieves burning sensation and irritation in eyes,30,https://firebasestorage.googleapis.com/v0/b/app-project-ayurveda2.appspot.com/o/1653296048537_eye drop.jpg?alt=media&token=image,"Aankho m jalan, eye drop,Eye Mantra Eye Drop",Do not exceed the recommended drops,"Rose,Honey,Daruhaldi,Punarnava",2-3 drops thrice a day or as directed by physician,628b7d5d2f61643132a89b1f
Saffola Immuniveda Kadha 50 sachets,143,"Saffola Immuniveda Kadha Mix is a unique Ayurvedic recipe containing ingredients that help in boosting your immunity, support your respiratory health and help relieve cough, cold and sore throat. It is made from a combination of the powerful ingredients of Ayush Kwath, along with 11 carefully selected ayurvedic herbs. Following the traditional process, Ayush Kwath and other herbs are crushed & boiled in water for hours to make into a decoction to harness its benefits",40,https://firebasestorage.googleapis.com/v0/b/app-project-ayurveda2.appspot.com/o/1653299942808_Saffola Immuniveda Kadha 50 sachets.jpg?alt=media&token=image,"cold,Saffola Immuniveda Kadha 50 sachets,sardi,zukham",Consult a health professional before using ,"Yestimadhu (Glycyrrhiza glabra St., Rt.) 1.0g, Dalchini (Cinnamonum zeylanicum St. Bk.) 0.25g, Kali Mirch (Piper nigrum Fr.) 0.25g, Haridra (Curcuma longa Rz.) 0.5g, Kantakari (Solanum surattense Wh. Pl.) 1.25g, Kankol (Piper cubeba Dr. Fr.) 1.25g,Vasa (Adhatoda vasica Lf.) 1.25g, Kulanjan (Alpenia galangal Rz.) 1.25g, Sunthi Extract (Zingiber officinale Rz. Ext.) 0.75g, Excipients - Q. S. Approved preservatives - Potassium Sorbate & Sodium benzoate – Q.S",Consume 1 sachet each day or as directed by your physician,628b7d5d2f61643132a89b1f
Saffola Immuniveda Golden Turmeric Milk Mix - Immunity Booster 400 g Jar,299,"Saffola ImmuniVeda Golden Turmeric Milk Mix is an instant mix based on the time-tested immunity boosting recipe ""Haldi-Doodh"". Each serve of this mix has the goodness of 2 spoons of Turmeric, which helps boost immunity and manage inflammation. This healthy drink is enriched with Cardamom, Cinnamon and Black Pepper - is tasty as well. Black Pepper aids in digestion and helps in absorption of turmeric in the body, so you can get all its benefits",50,https://firebasestorage.googleapis.com/v0/b/app-project-ayurveda2.appspot.com/o/1653300016043_Saffola Immuniveda Golden Turmeric Milk Mix - Immunity Booster 400 g Jar.jpg?alt=media&token=image,"cough,sardi,zukham,Saffola Immuniveda Golden Turmeric Milk Mix - Immunity Booster 400 g Jar","As with any supplement, consult a healthcare practitioner before use if you are pregnant, nursing, taking medication","Each 100 g Powder contains: Haldi powder (Curcuma longa Rz.) 1.60 g, Haldi Extract (Curcuma longa Rz,) 1.50 g, Elaichi Powder (Elettaria cardamomum Fr.) 0.10 g, Elaichi Extract (Elettaria cardamomum Fr.) 0.10 g, Kali Mirch Powder (Piper nigrum Fr.) 0.20 g, Kali Mirch Extract (Piper nigrum Fr.) 0.05 g, Dalchini Extract (Cinnamonum zeylanicum St. Bk.) 0.03 g, Almond flakes (Prunus amygdalus Sd.) 2.60 g. Permitted Excipients Q.S",Take 1 Scoop*(20g) of Saffola Immuniveda Golden Turmeric Milk Mix. (2)Add 200ml of Milk (or water) (3) Mix thoroughly and consume Consume 1-2 times a day or as directed by physician,628b7d5d2f61643132a89b1f
